11:18:09.402857 IP 172.16.13.21.22 > 172.16.11.88.3046: Flags [P.], seq 4251077537:4251077733, ack 3675903235, win 254, length 196
11:18:09.403129 IP 172.16.11.88.3046 > 172.16.13.21.22: Flags [.], ack 196, win 16272, length 0
11:18:09.443648 IP 52.35.149.230.443 > 172.16.13.21.45259: Flags [.], ack 119448970, win 68, options [nop,nop,TS val 1810950353 ecr 608152], length 0
11:18:09.504643 STP 802.1d, Config, Flags [none], bridge-id 8000.00:23:04:b4:da:ca.8001, length 43
11:18:09.671360 ARP, Request who-has 172.16.9.9 tell 172.16.11.9, length 46
11:18:09.707348 ARP, Request who-has 172.16.9.55 tell 172.16.8.1, length 46
11:18:10.215879 IP 172.16.8.24.21845 > 172.16.15.255.17476: UDP, length 19
11:18:10.215928 IP 172.16.8.24.21845 > 172.16.15.255.17476: UDP, length 19
11:18:10.215989 IP 172.16.8.24.21845 > 172.16.15.255.17476: UDP, length 19
11:18:10.671477 ARP, Request who-has 172.16.9.9 tell 172.16.11.9, length 46
11:18:10.707370 ARP, Request who-has 172.16.9.55 tell 172.16.8.1, length 46
11:18:11.004690 IP 172.16.11.9.50207 > 172.16.15.255.1947: UDP, length 40
11:18:11.484761 IP 172.16.11.70.61277 > 255.255.255.255.1947: UDP, length 40
11:18:11.504110 STP 802.1d, Config, Flags [none], bridge-id 8000.00:23:04:b4:da:ca.8001, length 43
11:18:11.528333 IP 172.16.8.24.21845 > 172.16.15.255.17476: UDP, length 19
11:18:11.528372 IP 172.16.8.24.21845 > 172.16.15.255.17476: UDP, length 19
11:18:11.528440 IP 172.16.8.24.21845 > 172.16.15.255.17476: UDP, length 19
11:18:12.191712 ARP, Request who-has 172.16.9.55 tell 172.16.8.1, length 46
11:18:12.258711 IP 172.16.13.116.1033 > 255.255.255.255.1947: UDP, length 40
11:18:12.299300 IP 10.18.199.131.51728 > 10.18.199.255.1947: UDP, length 40
11:18:12.432323 ARP, Request who-has 172.16.8.4 tell 172.16.11.26, length 46
11:18:12.534974 ARP, Request who-has 172.16.11.26 tell 172.16.8.4, length 46
11:18:12.556282 ARP, Request who-has 172.16.11.21 tell 172.16.8.3, length 46
11:18:12.840931 IP 172.16.8.24.21845 > 172.16.15.255.17476: UDP, length 19
11:18:12.840965 IP 172.16.8.24.21845 > 172.16.15.255.17476: UDP, length 19
11:18:12.841030 IP 172.16.8.24.21845 > 172.16.15.255.17476: UDP, length 19
11:18:13.191405 ARP, Request who-has 172.16.9.55 tell 172.16.8.1, length 46
11:18:13.503596 STP 802.1d, Config, Flags [none], bridge-id 8000.00:23:04:b4:da:ca.8001, length 43
11:18:13.676999 ARP, Request who-has 172.16.13.116 tell 172.16.8.4, length 46
11:18:14.153427 IP 172.16.8.24.21845 > 172.16.15.255.17476: UDP, length 19
11:18:14.153474 IP 172.16.8.24.21845 > 172.16.15.255.17476: UDP, length 19
11:18:14.153536 IP 172.16.8.24.21845 > 172.16.15.255.17476: UDP, length 19
11:18:14.191422 ARP, Request who-has 172.16.9.55 tell 172.16.8.1, length 46
11:18:14.278120 IP 172.16.11.88.3182 > 172.16.13.21.80: Flags [S], seq 3557408142, win 8192, options [mss 1460,nop,wscale 2,nop,nop,sackOK], length 0
11:18:14.278164 IP 172.16.13.21.80 > 172.16.11.88.3182: Flags [R.], seq 0, ack 3557408143, win 0, length 0
11:18:14.374642 ARP, Request who-has 172.16.9.38 tell 172.16.13.50, length 46
11:18:14.375710 ARP, Request who-has 172.16.9.38 tell 172.16.13.50, length 46
11:18:14.529482 IP 172.16.11.88.3183 > 172.16.13.21.80: Flags [S], seq 358772268, win 8192, options [mss 1460,nop,wscale 2,nop,nop,sackOK], length 0
11:18:14.529530 IP 172.16.13.21.80 > 172.16.11.88.3183: Flags [R.], seq 0, ack 358772269, win 0, length 0
11:18:14.658910 IP 172.16.13.13.54948 > 172.16.15.255.1947: UDP, length 40
11:18:14.786655 IP 172.16.11.88.3182 > 172.16.13.21.80: Flags [S], seq 3557408142, win 8192, options [mss 1460,nop,wscale 2,nop,nop,sackOK], length 0
11:18:14.786700 IP 172.16.13.21.80 > 172.16.11.88.3182: Flags [R.], seq 0, ack 1, win 0, length 0
11:18:14.893573 IP 172.16.11.88.54094 > 255.255.255.255.1947: UDP, length 40
11:18:15.029734 IP 172.16.11.88.3183 > 172.16.13.21.80: Flags [S], seq 358772268, win 8192, options [mss 1460,nop,wscale 2,nop,nop,sackOK], length 0
11:18:15.029784 IP 172.16.13.21.80 > 172.16.11.88.3183: Flags [R.], seq 0, ack 1, win 0, length 0
11:18:15.088266 IP 172.16.11.132.51013 > 255.255.255.255.1947: UDP, length 40
11:18:15.232142 ARP, Request who-has 172.16.9.55 tell 172.16.8.1, length 46
11:18:15.285739 IP 172.16.11.88.3182 > 172.16.13.21.80: Flags [S], seq 3557408142, win 8192, options [mss 1460,nop,nop,sackOK], length 0
11:18:15.285781 IP 172.16.13.21.80 > 172.16.11.88.3182: Flags [R.], seq 0, ack 1, win 0, length 0
11:18:15.287596 IP 172.16.11.88.3184 > 172.16.13.21.80: Flags [S], seq 2299459792, win 8192, options [mss 1460,nop,wscale 2,nop,nop,sackOK], length 0
11:18:15.287608 IP 172.16.13.21.80 > 172.16.11.88.3184: Flags [R.], seq 0, ack 2299459793, win 0, length 0
11:18:15.465952 IP 172.16.8.24.21845 > 172.16.15.255.17476: UDP, length 19
11:18:15.465979 IP 172.16.8.24.21845 > 172.16.15.255.17476: UDP, length 19
11:18:15.466045 IP 172.16.8.24.21845 > 172.16.15.255.17476: UDP, length 19
11:18:15.490950 IP 10.18.199.70.61277 > 10.18.199.255.1947: UDP, length 40
11:18:15.503039 STP 802.1d, Config, Flags [none], bridge-id 8000.00:23:04:b4:da:ca.8001, length 43
11:18:15.529775 IP 172.16.11.88.3183 > 172.16.13.21.80: Flags [S], seq 358772268, win 8192, options [mss 1460,nop,nop,sackOK], length 0
11:18:15.529826 IP 172.16.13.21.80 > 172.16.11.88.3183: Flags [R.], seq 0, ack 1, win 0, length 0
11:18:15.530585 IP 172.16.11.88.3185 > 172.16.13.21.80: Flags [S], seq 3713451844, win 8192, options [mss 1460,nop,wscale 2,nop,nop,sackOK], length 0
11:18:15.530598 IP 172.16.13.21.80 > 172.16.11.88.3185: Flags [R.], seq 0, ack 3713451845, win 0, length 0
11:18:15.786771 IP 172.16.11.88.3184 > 172.16.13.21.80: Flags [S], seq 2299459792, win 8192, options [mss 1460,nop,wscale 2,nop,nop,sackOK], length 0
11:18:15.786817 IP 172.16.13.21.80 > 172.16.11.88.3184: Flags [R.], seq 0, ack 1, win 0, length 0
11:18:16.029814 IP 172.16.11.88.3185 > 172.16.13.21.80: Flags [S], seq 3713451844, win 8192, options [mss 1460,nop,wscale 2,nop,nop,sackOK], length 0
11:18:16.029862 IP 172.16.13.21.80 > 172.16.11.88.3185: Flags [R.], seq 0, ack 1, win 0, length 0
11:18:16.189468 ARP, Request who-has 172.16.13.2 tell 172.16.8.1, length 46
11:18:16.231447 ARP, Request who-has 172.16.9.55 tell 172.16.8.1, length 46
11:18:16.273815 IP 172.16.13.116.1033 > 172.16.15.255.1947: UDP, length 40
11:18:16.284827 IP 172.16.11.88.3184 > 172.16.13.21.80: Flags [S], seq 2299459792, win 8192, options [mss 1460,nop,nop,sackOK], length 0
11:18:16.284862 IP 172.16.13.21.80 > 172.16.11.88.3184: Flags [R.], seq 0, ack 1, win 0, length 0
11:18:16.324129 IP 172.16.11.131.51728 > 172.16.15.255.1947: UDP, length 40
11:18:16.395152 ARP, Request who-has 172.16.9.37 tell 172.16.13.50, length 46
11:18:16.396624 ARP, Request who-has 172.16.9.37 tell 172.16.13.50, length 46
11:18:16.529843 IP 172.16.11.88.3185 > 172.16.13.21.80: Flags [S], seq 3713451844, win 8192, options [mss 1460,nop,nop,sackOK], length 0
11:18:16.529895 IP 172.16.13.21.80 > 172.16.11.88.3185: Flags [R.], seq 0, ack 1, win 0, length 0
11:18:16.778234 IP 172.16.8.24.21845 > 172.16.15.255.17476: UDP, length 19
11:18:16.778268 IP 172.16.8.24.21845 > 172.16.15.255.17476: UDP, length 19
11:18:16.778333 IP 172.16.8.24.21845 > 172.16.15.255.17476: UDP, length 19
11:18:17.231474 ARP, Request who-has 172.16.9.55 tell 172.16.8.1, length 46
11:18:17.503089 STP 802.1d, Config, Flags [none], bridge-id 8000.00:23:04:b4:da:ca.8001, length 43
11:18:18.090760 IP 172.16.8.24.21845 > 172.16.15.255.17476: UDP, length 19
11:18:18.090788 IP 172.16.8.24.21845 > 172.16.15.255.17476: UDP, length 19
11:18:18.090852 IP 172.16.8.24.21845 > 172.16.15.255.17476: UDP, length 19
11:18:18.716266 ARP, Request who-has 172.16.9.55 tell 172.16.8.1, length 46
11:18:18.899204 IP 10.18.199.88.54094 > 10.18.199.255.1947: UDP, length 40
11:18:19.094070 IP 10.18.199.132.51013 > 10.18.199.255.1947: UDP, length 40
11:18:19.260070 ARP, Request who-has 172.16.11.18 tell 172.16.11.8, length 46
11:18:19.260475 ARP, Request who-has 172.16.11.8 tell 172.16.11.18, length 46
11:18:19.388004 IP 172.16.8.7.56172 > 255.255.255.255.1947: UDP, length 40
11:18:19.403197 IP 172.16.8.24.21845 > 172.16.15.255.17476: UDP, length 19
11:18:19.403227 IP 172.16.8.24.21845 > 172.16.15.255.17476: UDP, length 19
11:18:19.403285 IP 172.16.8.24.21845 > 172.16.15.255.17476: UDP, length 19
11:18:19.446400 IP 172.16.13.21.45259 > 52.35.149.230.443: Flags [.], ack 0, win 772, options [nop,nop,TS val 620896 ecr 1810950353], length 0
11:18:19.446447 IP 172.16.11.130.62935 > 255.255.255.255.1947: UDP, length 40
11:18:19.496253 IP 172.16.11.70.61277 > 172.16.15.255.1947: UDP, length 40
11:18:19.502002 STP 802.1d, Config, Flags [none], bridge-id 8000.00:23:04:b4:da:ca.8001, length 43
11:18:19.683584 IP 52.35.149.230.443 > 172.16.13.21.45259: Flags [.], ack 1, win 68, options [nop,nop,TS val 1810952913 ecr 608152], length 0
11:18:19.715504 ARP, Request who-has 172.16.9.55 tell 172.16.8.1, length 46
11:18:20.497246 IP 172.16.11.223.1038 > 255.255.255.255.1947: UDP, length 40
11:18:20.715527 ARP, Request who-has 172.16.9.55 tell 172.16.8.1, length 46
11:18:20.715759 IP 172.16.8.24.21845 > 172.16.15.255.17476: UDP, length 19
11:18:20.715793 IP 172.16.8.24.21845 > 172.16.15.255.17476: UDP, length 19
11:18:20.715886 IP 172.16.8.24.21845 > 172.16.15.255.17476: UDP, length 19
11:18:21.282497 IP 172.16.13.13.51794 > 172.16.15.255.1947: UDP, length 40
11:18:21.501446 STP 802.1d, Config, Flags [none], bridge-id 8000.00:23:04:b4:da:ca.8001, length 43
11:18:21.987906 ARP, Request who-has 172.16.11.86 tell 172.16.8.3, length 46
11:18:22.016968 IP 172.16.11.86.137 > 172.16.15.255.137: NBT UDP PACKET(137): QUERY; REQUEST; BROADCAST
11:18:22.028249 IP 172.16.8.24.21845 > 172.16.15.255.17476: UDP, length 19
11:18:22.028285 IP 172.16.8.24.21845 > 172.16.15.255.17476: UDP, length 19
11:18:22.028349 IP 172.16.8.24.21845 > 172.16.15.255.17476: UDP, length 19
11:18:22.678143 IP 172.16.11.88.3186 > 172.16.13.21.8000: Flags [S], seq 492466580, win 8192, options [mss 1460,nop,wscale 2,nop,nop,sackOK], length 0
11:18:22.678192 IP 172.16.13.21.8000 > 172.16.11.88.3186: Flags [R.], seq 0, ack 492466581, win 0, length 0
11:18:22.767021 IP 172.16.11.86.137 > 172.16.15.255.137: NBT UDP PACKET(137): QUERY; REQUEST; BROADCAST
11:18:22.767222 IP 172.16.13.85.137 > 172.16.15.255.137: NBT UDP PACKET(137): QUERY; REQUEST; BROADCAST
11:18:22.904584 IP 172.16.11.88.54094 > 172.16.15.255.1947: UDP, length 40
11:18:22.929179 IP 172.16.11.88.3187 > 172.16.13.21.8000: Flags [S], seq 3233267535, win 8192, options [mss 1460,nop,wscale 2,nop,nop,sackOK], length 0
11:18:22.929215 IP 172.16.13.21.8000 > 172.16.11.88.3187: Flags [R.], seq 0, ack 3233267536, win 0, length 0
11:18:23.082798 ARP, Request who-has 172.16.9.55 tell 172.16.8.1, length 46
11:18:23.099339 IP 172.16.11.132.51013 > 172.16.15.255.1947: UDP, length 40
11:18:23.237439 IP 172.16.11.88.3186 > 172.16.13.21.8000: Flags [S], seq 492466580, win 8192, options [mss 1460,nop,wscale 2,nop,nop,sackOK], length 0
11:18:23.237487 IP 172.16.13.21.8000 > 172.16.11.88.3186: Flags [R.], seq 0, ack 1, win 0, length 0
11:18:23.284951 IP 172.16.13.13.54957 > 172.16.15.255.1947: UDP, length 40
11:18:23.340934 IP 172.16.8.24.21845 > 172.16.15.255.17476: UDP, length 19
11:18:23.340965 IP 172.16.8.24.21845 > 172.16.15.255.17476: UDP, length 19
11:18:23.341027 IP 172.16.8.24.21845 > 172.16.15.255.17476: UDP, length 19
11:18:23.401096 IP 10.18.199.9.56172 > 10.18.199.255.1947: UDP, length 40
11:18:23.428469 IP 172.16.11.88.3187 > 172.16.13.21.8000: Flags [S], seq 3233267535, win 8192, options [mss 1460,nop,wscale 2,nop,nop,sackOK], length 0
11:18:23.428500 IP 172.16.13.21.8000 > 172.16.11.88.3187: Flags [R.], seq 0, ack 1, win 0, length 0
11:18:23.469841 IP 10.18.199.130.62935 > 10.18.199.255.1947: UDP, length 40
11:18:23.500902 STP 802.1d, Config, Flags [none], bridge-id 8000.00:23:04:b4:da:ca.8001, length 43
11:18:23.516981 IP 172.16.11.86.137 > 172.16.15.255.137: NBT UDP PACKET(137): QUERY; REQUEST; BROADCAST
11:18:23.582320 ARP, Request who-has 172.16.9.31 tell 172.16.8.1, length 46
11:18:23.737498 IP 172.16.11.88.3186 > 172.16.13.21.8000: Flags [S], seq 492466580, win 8192, options [mss 1460,nop,nop,sackOK], length 0
11:18:23.737543 IP 172.16.13.21.8000 > 172.16.11.88.3186: Flags [R.], seq 0, ack 1, win 0, length 0
11:18:23.934525 IP 172.16.11.88.3187 > 172.16.13.21.8000: Flags [S], seq 3233267535, win 8192, options [mss 1460,nop,nop,sackOK], length 0
11:18:23.934600 IP 172.16.13.21.8000 > 172.16.11.88.3187: Flags [R.], seq 0, ack 1, win 0, length 0
11:18:23.935533 IP 172.16.11.88.3188 > 172.16.13.21.8000: Flags [S], seq 4121594743, win 8192, options [mss 1460,nop,wscale 2,nop,nop,sackOK], length 0
11:18:23.935546 IP 172.16.13.21.8000 > 172.16.11.88.3188: Flags [R.], seq 0, ack 4121594744, win 0, length 0
11:18:24.079567 ARP, Request who-has 172.16.9.55 tell 172.16.8.1, length 46
11:18:24.218761 IP 172.16.11.223.1038 > 172.16.15.255.1947: UDP, length 40
11:18:24.242896 ARP, Request who-has 172.16.8.12 tell 172.16.11.20, length 46
11:18:24.435525 IP 172.16.11.88.3188 > 172.16.13.21.8000: Flags [S], seq 4121594743, win 8192, options [mss 1460,nop,wscale 2,nop,nop,sackOK], length 0
11:18:24.435573 IP 172.16.13.21.8000 > 172.16.11.88.3188: Flags [R.], seq 0, ack 1, win 0, length 0
11:18:24.579570 ARP, Request who-has 172.16.9.31 tell 172.16.8.1, length 46
11:18:24.653445 IP 172.16.8.24.21845 > 172.16.15.255.17476: UDP, length 19
11:18:24.653479 IP 172.16.8.24.21845 > 172.16.15.255.17476: UDP, length 19
11:18:24.653542 IP 172.16.8.24.21845 > 172.16.15.255.17476: UDP, length 19
11:18:24.935586 IP 172.16.11.88.3188 > 172.16.13.21.8000: Flags [S], seq 4121594743, win 8192, options [mss 1460,nop,nop,sackOK], length 0
11:18:24.935635 IP 172.16.13.21.8000 > 172.16.11.88.3188: Flags [R.], seq 0, ack 1, win 0, length 0
11:18:24.975094 IP 172.16.13.50.1026 > 255.255.255.255.1947: UDP, length 40
11:18:25.079578 ARP, Request who-has 172.16.9.55 tell 172.16.8.1, length 46
11:18:25.500392 STP 802.1d, Config, Flags [none], bridge-id 8000.00:23:04:b4:da:ca.8001, length 43
11:18:25.579595 ARP, Request who-has 172.16.9.31 tell 172.16.8.1, length 46
11:18:25.587047 LLDP, length 169: ProCurve Switch 4204vl
11:18:25.717712 IP 172.16.11.10.50844 > 255.255.255.255.1947: UDP, length 40
11:18:25.768717 IP 172.16.9.15.57391 > 172.16.15.255.3052: UDP, length 1000
11:18:25.909129 IP 172.16.13.160.53785 > 255.255.255.255.1947: UDP, length 40
11:18:25.966020 IP 172.16.8.24.21845 > 172.16.15.255.17476: UDP, length 19
11:18:25.966052 IP 172.16.8.24.21845 > 172.16.15.255.17476: UDP, length 19
11:18:25.966116 IP 172.16.8.24.21845 > 172.16.15.255.17476: UDP, length 19

